Episode,Start Timecode,End Timecode,Speaker,Transcript,Notes
55,00:00:14.27,00:00:37.37,Sebastian Arendt,"Die Nacht war angenehm. Also es war nicht kalt. Deswegen waren alles angenehm im Alarmposten, Streife bewegt man sich ja sowieso, da wird man sowieso warm. Danach kurze, schöne Feuerwache und sich aufwärmen und dann wieder schön in nen Schlafsack rein und dann schlafen. Gibt es nichts besseres? Alles schön.",
55,00:00:37.70,00:00:48.22,Lukas Keitel,Also so effektiv im Zelt habe ich zwei Stunden geschlafen. So um den Dreh. Ich musste so des Todes aufs Klo. Das glaubst du gar nicht.,
55,00:00:48.22,00:00:56.69,Stabsgefreiter Neubert,"Ach doch alles gut. Alles bestens. Die Leute haben wieder gute Laune. Jetzt sind sie auch ein bisschen warm und dann hoffe ich, dass wir jetzt nachher so eine ner halbe Stunde dann in den Tag starten können.",
55,00:00:56.87,00:01:04.88,Dominik Mönig,"Augen, wie nen Kugelfisch, ey. Sehr, sehr wenig Schlaf und ich habe keine Ahnung, wie viel Uhr wir jetzt haben. Es kommt mir knapp vor wie ..",
55,00:01:04.88,00:01:04.88,Lukas Keitel,Kurz nach Sechs.,
55,00:01:04.94,00:01:11.51,Dominik Mönig,Kurz nach sechs. Also haben wir in zwei Tagen knappe 4 Stunden geschlafen. Hätte gern nen Minütchen mehr.,
55,00:01:12.05,00:01:20.96,Oberbootsmann Sowa,"Die Nacht war, muss ich ehrlich mal echt sagen Scheiße, weil ich musste pinkeln. Es war Schweine kalt und das ist nicht mein Wetter. ",
55,00:01:20.96,00:01:22.25,Sebastian Arendt,Da Kamerad verlegt rein.,
55,00:01:22.67,00:01:36.68,Lukas Keitel,"Ich finde es schade, ich wäre echt noch länger hier geblieben  Ich find es macht mega Spaß. Auch wenn man fast keinen Schlaf oder ziemlich wenig Schlaf bekommt. Aber es hat einfach keinen Wert mehr. Leute. Tschau.",
55,00:01:36.68,00:01:38.18,Oberbootsmann Sowa,Gute Besserung.,
55,00:01:38.21,00:01:55.52,Lukas Keitel,"Ich finds zwar richtig scheiße, dass ich gehen muss, weil es richtig Spaß gemacht hat. Ich will nächste Woche nicht ausfallen. Nicht so kurz vorm Ende. Man kriegt kaum Schlaf. Das ist die ganze Zeit dunkel und kalt. Aber es macht trotzdem Spaß. Hört sich vielleicht komisch an, aber das kann man nur sagen, wenn. Wenn man dabei gewesen ist.",
55,00:01:55.85,00:02:04.82,Oberbootsmann Peterson,"Also frühzeitig abbrechen darf man eigentlich nur aus einem Grund. Das kann nur der gesundheitliche Grund sein. Also man kann jetzt nicht sich hinstellen und sagen Hey Gruppenführer, ich möchte nicht mehr, ich kann nicht mehr oder wollte nicht aufhören.",
55,00:02:05.00,00:02:12.89,Oberbootsmann Peterson,"Das kann man natürlich auch machen in dem Sinne, wenn man sagt Ich möchte die Grundausbildung abbrechen. Komplett. Aber man kann nicht sagen, ich möchte reinfahren und morgen bin ich wieder mit dabei. Das geht nicht.",
55,00:02:13.01,00:02:22.82,Sebastian Arendt,Hier steht der letzte harte Kern der zehnten Inspektion der letzten Rekruten. Der Rest hat sich verabschiedet in die Inspektion und unseren Bereich.,
55,00:02:25.58,00:02:36.02,Obermaat Scholwin,"Wir machen jetzt Ausbildung behelfsmäßig, Unterkunft im Feld. Danach gehen Sie über zur Ausbildung, Feuerstellen Arten und bewegen im Feld Orientierung im Feld.",
55,00:02:36.08,00:02:45.80,Stabsgefreiter Neubert,"Hier ist die Ausbildungsstation behelfsmäßige Unterkünfte. Ich möchte, dass Sie jetzt anfangen, versuchen, sich eine behelfsmäßige Unterkunft zu bauen mit den Sachen, die Sie hier vorfinden.",
55,00:02:46.01,00:02:48.09,Patrick Döring,"Richtig Gegenstemmen, Spannung brauchst du nicht.",
55,00:02:54.02,00:02:55.25,Unbekannter Rekrut,"Findest du nicht, der ist ein bisschen morsch?",
55,00:02:57.41,00:02:59.36,Matrose Martin,Jetzt ja. ,
55,00:02:59.36,00:03:04.55,Patrick Döring,Ich hab dir Holz gebracht. Kannst du weiter machen. ,
55,00:03:04.55,00:03:06.53,Unbekannter Rekrut,Übel geil. Also ich würde gerne hier drin schlafen. ,
55,00:03:06.53,00:03:06.97,Matrosin Schang,Sieht gut aus.,
55,00:03:08.33,00:03:13.49,Matrose Martin,"Das sieht vielleicht unstabil aus, aber das ist hier deutsche Ingenieurskunst.",
55,00:03:13.57,00:03:14.69,Matrosin Schang,Wir haben das gut gebaut zusammen.,
55,00:03:14.78,00:03:16.82,Unbekannter Rekrut,Der Oger dahinten auch. ,
55,00:03:16.82,00:03:25.60,Matrosin Schang,Der Oger! Wir passen sogar zu dritt mit Koppel hier rein. Also geil.,
55,00:03:25.60,00:03:25.60,Obermaat Scholwin,Ausbildungsziel ist damit erreicht.,
55,00:03:30.05,00:03:42.36,Stabsgefreiter Neubert,"Das Grundprinzip ist überall dasselbe drinne, aber die Geschmacksrichtungen variieren etwas. Wir machen das mal zusammen auf. Wir haben hier Streichhölzer, Reinigungstücher, Instantkaffee, Kaugummi, alles ewig haltbar.",
55,00:03:42.38,00:04:01.52,Stabsgefreiter Neubert,"Wir haben sogar Brot. Irgendwelche Riegel, hart, Kekse, die essen sie. Und dann... Ich esse die zum Beispiel auch im Biwak gerne, weil dann brauche ich drei Tage nicht aufs Klo gehen. Also wer jetzt denkt, nur weil das Zeug hier 20, 30, 40 Jahre haltbar ist, das schmeckt nicht schlecht, wenn das warm ist. Hier ist zum Beispiel Ich habe Thunfisch mit Limette und Pfeffer total toll.",
55,00:04:01.70,00:04:05.21,Dominik Mönig,"Südamerikanisches Gemüse-Chili. Ich glaube, da hilft auch der Hartkeks nicht.",
55,00:04:06.62,00:04:10.40,Leon von Garrel,Aber sieht auf jeden Fall genauso aus wie das Chili was ich immer koche. ,
55,00:04:10.40,00:04:10.40,Dominik Mönig,Echt?,
55,00:04:10.40,00:04:14.87,Leon von Garrel,"Mein Chili ist einsame Spitze. Also da können Sie jeden fragen, der meinen Chili schon mal gegessen hat.",
55,00:04:14.87,00:04:15.70,Patrick Döring,Jetzt scheiden sich die Geister.,
55,00:04:16.07,00:04:17.27,Leon von Garrel,Das ist das beste Chili.,
55,00:04:17.27,00:04:19.55,Patrick Döring,Da kennst du aber mein Chili con Carne nicht!,
55,00:04:19.78,00:04:24.11,Marvin Baunach,Also das ist schon echt Premium hier. Schön salzig.,
55,00:04:24.38,00:04:31.22,Dominik Mönig,Ich werd es mir jetzt munden lassen auf jeden Fall. Schön nen Chili con Carne südamerikanischen Soja von ganz ganz weit her.,
55,00:04:33.95,00:04:47.54,Oberbootsmann Sowa,"Die Rekruten sollen sich jetzt hier sammeln Ausrüstung anlegen und jetzt wird es langsam schummrig. Jetzt können wir mit Ausbildung weitermachen, damit wir das Signal besser schießen können. So also Stellung beziehen, Alarm posten, wieder Streife gehen. Das was wir gestern schon gemacht haben, vertiefen wir heute.",
55,00:04:47.58,00:04:58.55,Matrosin Schang,"Die letzte Nacht sollten wir alle eigentlich noch durchhalten. Ich auch. Ich bin zwar jetzt seit halb zwei gestern wach, morgens, weil ich nicht geschlafen habe. Also es wird sportlich,",
55,00:04:58.97,00:05:13.82,Dominik Mönig,"Aber heute Abend wird es ein bisschen chaotisch ablaufen. Wir werden aus unseren Stellungen. Auf Befehl werden wir rausrücken, nachdem wir dem Feind ein bisschen hingehalten haben und stürmen im Endeffekt das Feld und werden mit Feuerstoß feuern. Das heißt also, alles was das Gewehr hergibt. ",
55,00:05:13.82,00:05:30.80,Oberbootsmann Sowa,Hält sich an die Waffe und suchen jetzt den Druckpunkt an der Waffe am Abzug. Jetzt. Ey! Sie sollen nur den Druckpunkt suchen! Feuer. Übungsende.,
55,00:05:31.85,00:05:45.71,Dominik Mönig,"Ja ist was Neues. Und was wir jetzt gerade auch noch gelernt haben, ist zum Beispiel, dass der Gegner läuft mittig über das Feld hinab und beschießt uns und wir feuern. Aus mehreren Stellungen weiß er natürlich so ungefähr, wie breit wir unser Lager aufgebaut haben.",
55,00:05:45.71,00:06:11.24,Dominik Mönig,"Um das zu vermeiden, haben wir jetzt gerade den Feuerstoß gemacht, das heißt alle auf einmal so gut es geht feuern. Da kann der Gegner das nicht einschätzen. Scheiße, wie viele Gefechtsstände, wie viele Leute oder sonstwas. Es hört sich an wie ein Schuss, können aber dann entweder 100 sein, wenn es natürlich top geteilt ist oder halt 50 jenachdem. Täuschen der Gegner ein bisschen verwirren und hoffen, dass er es annimmt und dass er damit dann auch ein bisschen hinten halt können.",
55,00:06:11.48,00:06:24.83,Patrick Döring,"Ja, ich habe mit mein Wiesel hier das Wald-Frettchen, das habe ich mir hier im Wald gesucht für die Stellung. Mal gucken was passiert. Es macht halt jetzt richtig Spaß auch mit den Leuten zusammen zu sein. Die die hier sind, die haben halt richtig, wirklich Bock das ganze durchzuziehen.",
55,00:06:24.92,00:06:31.32,Leon von Garrel,"Es wurde gerade Stiller Alarm ausgelöst. Wir warten jetzt darauf, dass die restlichen Kräfte in die Stellung einsickern.",
55,00:06:39.85,00:07:00.21,Stabsgefreiter Neubert,"Das Klarzeichen ist ein lauter Knall! Stellung räumen, sammeln, Platz der Gruppe Ausübung. ",
55,00:07:00.21,00:07:12.76,Sebastian Arendt,"Hier draußen kann man nie genug kriegen hmmm, da kam das Stichwort Nachschlag. Bei dem Wetter geht nichts über eine schöne heiße Brühe und oder bzw. hier schönes Gulasch, Eintopf wow. ",
55,00:07:13.33,00:07:22.40,Dominik Mönig,"Also jede warme Mahlzeit tut gut. Ist ne harte Nummer. Da bleibt man immer so langsam irgendwann auf der Stelle und da merkt man erst mal wie down man ist, wenn man so ein bisschen so einen Ruhepunkt gefunden hat.",
55,00:07:22.78,00:07:30.91,Marvin Baunach,"Jetzt hatte ich Currywurst. Und jetzt ess ich noch ein Brot und den Rest hebe ich mir für morgen früh auf, da ist noch Müsli drinne.",
55,00:07:31.01,00:07:44.47,Dominik Mönig,"Erst mal schönes Bütterchen, ne olle Stulle megageil. Biwak hier würde ich jedem empfehlen, einmal mitzumachen, auch bei den Temperaturen. Also es ist nicht kalt im Schlafsack oder so! Es ist nur geil. ",
55,00:07:44.47,00:07:54.85,Stabsgefreiter Neubert,"Wir werden noch ein paar Lagen fahren. Dass die Rekruten nochmal ein bisschen ins Schwitzen kommen, ein paar Angriffe, ein bisschen Feuerwerk und dann denk ich mal, wenn wir den Abend in aller Ruhe ausklingen lassen.",
55,00:07:55.06,00:08:01.90,Marvin Baunach,Schöner Bratapfel schmeckt besser als son kalter Apfel.,
55,00:08:02.83,00:08:12.58,Patrick Döring,"Es ist ein schönes Biwak. Ich habe am Anfang auch überlegt, ob Biwak und so von den Erzählungen her. Aber alles was du bisher mitgemacht hast, ist absoluter Hammer. Also es ist ein richtig geiles Biwak.",
55,00:08:12.64,00:08:21.38,Leon von Garrel,"Aber was die MSGler ja noch nicht wissen, die dürfen unsere Sachen purzen. Wenn wir morgen aus dem Biwak kommen, davon wissen die ja noch nix.",
55,00:08:22.42,00:08:39.26,Stabsgefreiter Meliss,"Ja, also wir haben jetzt noch mal eine nächtliche Lage, dass wir mit Fahrzeug angreifen. Dazu nehmen wir unseren LKW, vier Schützen, einer oben aus dem Dach, der Rest springt hinten raus, verteilt sich ein bisschen auf dem Feld. Das die Rekruten auch mal das Gefühl haben wie es ist vom Fahrzeug angegriffen zu werden, wenn wirklich mal größeres Gerät auf sie zu gerollen kommt.",
55,00:08:39.28,00:08:50.11,Stabsgefreiter Meliss,"Wenn wir dann mit Fernlicht anrollen, dass sie auch einfach mal gar nicht sehen, was jetzt wirklich so auf sie zukommt, sondern nur vom hören merken, da kommt was Großes, dann knallt es, dass wir sie so ein bisschen versuchen zu überfordern mit einer Situation, die sie bis jetzt noch nicht hatten.",
55,00:08:50.17,00:08:58.75,Oberbootsmann Sowa,Ja verstanden. Stellung werden bezogen. Alpha Eins Ende. Alarm! Stellung Beziehen. Bewegung.,
55,00:09:04.26,00:09:12.63,Oberbootsmann Sowa,"Drei Personen, 10, elf Uhr.",
55,00:09:15.20,00:09:57.46,Stabsgefreiter Neubert,"Wir nehmen den auf 12 Uhr zwölf Uhr. Feuern Sie! So, letztes Magazin.",
55,00:10:00.28,00:10:04.30,Unbekannter Rekrut,So viel können wir gar nicht verballern. Wie wir hier krippen müssen.,
55,00:10:04.30,00:10:05.38,Oberbootsmann Sowa,Übungsende. ,
55,00:10:05.38,00:10:06.00,Dominik Mönig,Wurde getroffen.,
55,00:10:06.90,00:10:10.94,Unbekannter Rekrut,Können sie laufen. Kannst du laufen? Hmmm. ,
55,00:10:11.00,00:10:13.30,Dominik Mönig,Ja. Mit Hilfe.,
55,00:10:13.75,00:10:16.48,Unbekannter Rekrut,"Langsam, langsam. ",
55,00:10:16.48,00:10:31.03,Oberbootsmann Peterson,"Ja war relativ gut die Übung. Rekruten haben relativ gut reagiert, war ganz ok. Die Alarmierung bis zum bis sie ausgerückt waren in ihren Kampfständen. Der Alarmposten hat auch relativ gut reagiert. Aber kleine Verbesserungen. Verbesserungswürdig ist es immer, aber hat Spaß gemacht.",
55,00:10:31.39,00:10:43.31,Dominik Mönig,Wollte gerade auf munitioniert. In dem Moment trifft mich der Gegner direkt am Auge. Zwo Kameraden kam mir sofort zu Hilfe. Haben mir ein Druckverband am Kopf angelegt und wollten mich aus dem Graben abtransportieren.,
55,00:10:43.33,00:10:58.57,Dominik Mönig,"Ist hart so in der Hektik. Auf jeden Fall. Man man hat den Leuten so angemerkt, dass das halt noch nicht so routinemäßig sitzt und so. Ich meine, es ist ja auch verständlich. Dann noch mit mit Schüssen und ohne Schreierei und sowas. Also. Da spielt schon alles ein Faktor.",
55,00:10:58.72,00:11:15.64,Patrick Döring,"Kommt halt das Ganze für das wir ausgebildet wurden zum Vorschein. Aber du merkst halt einfach, dass du in der Situation, wenn Verletzte vor dir liegen, sag ich mal einfach anders reagierst, weil du voller Adrenalin bist. Du wirst angeschrien und stehst unter Beschuss und weiß nicht so richtig, wie du dich beim ersten Mal richtig verhalten sollst.",
55,00:11:15.64,00:11:19.81,Oberbootsmann Sowa,"Gehen sie zum Platz der Gruppe und entspannen sie sich am Feuer, erzählen noch ein paar Gruselgeschichten. Keine Ahnung.",
55,00:11:20.15,00:11:29.11,Oberbootsmann Sowa,"War Ok, ich habe leider zu früh leer geschossen. Ich hab nichts mehr. Ich muss mir das Feuerwerk jetzt angucken. Aber ok, ich denke mal es war ein erfolgreicher Abschluss des Abends.",
55,00:11:29.20,00:11:44.08,Leon von Garrel,Das war heut das Biwak. Das Abschlussgefächt haben wir erfolgreich gewonnen. Wir sind die 10te. Wenn ihr sehen wollt wie unsere letzten Tage hier sind. Dann schaltet morgen wieder ein. Bis dahin. Wir gehen jetzt ans Feuer. Kommt Jungs. ,
55,00:11:44.08,00:11:49.12,Dominik Mönig,"Und immer schön. Liken, liken, liken. Alles! Macht alles!",
